{
  "request_id": "req_germline_sv_001",
  "user_goal": "Call germline SNPs and Indels from WES/WGS cohort data.",
  "request_text": "I have paired-end WES FASTQ files and need germline SNP/Indel discovery with a filtered cohort VCF.",
  "request_tags": [
    "germline-variant",
    "variant-calling",
    "wes",
    "snp-indel"
  ],
  "inputs": [],
  "constraints": [
    "Pause before cohort genotyping if resources look insufficient"
  ],
  "preferred_outputs": [
    "gvcf_bundle",
    "joint_vcf",
    "filtered_vcf"
  ],
  "context_notes": []
}
